{
  "title": "SWE-Touch：用户中途改代码时Coding Agent鲁棒性基准",
  "type": "论文",
  "topic_name": "AI Infra横向动态",
  "direction_name": "推理服务、运行时与编译优化",
  "published_at": "2026-08",
  "importance": "一般",
  "core_conclusion": "现有代码agent基准忽略用户任务中直接改共享代码库；该研究提出注入task-conflicting Counter-Edit的SWE-Touch基准，使SWE-bench Verified平均resolve rate下降7.7个百分点。",
  "mechanism": "用三个不同族模型修复轨迹挖掘task-critical区域，再由生成器构造与任务冲突的小编辑并用fail-to-pass测试验证，评估时在agent访问重叠代码时注入。",
  "result": "Counter-Edit使9个模型平均resolve rate降7.7个百分点（1.3到16.5点），63.3%失败运行保留用户冲突代码。",
  "boundary": "Counter-Edit为合成的任务冲突极端场景而非真实用户编辑分布，长程任务上注入可能不触发且主要评测最终状态。",
  "project_relevance": "判断：暴露当前代码agent在共享工作区缺变更检测与冲突调和，提示在搜索修改验证链路增加工作区状态感知。",
  "keywords": [
    "coding agent",
    "共享工作区",
    "冲突编辑",
    "鲁棒性基准",
    "SWE-bench"
  ],
  "sources": [
    {
      "publisher": "arXiv",
      "url": "https://arxiv.org/abs/2608.01536v1",
      "source_level": "A",
      "primary": true,
      "published_at": "2026-08"
    }
  ],
  "discovered_via": null,
  "incremental_update": false,
  "incremental_change": null,
  "score": 45
}