{
  "title": "LEAP：面向CUDA内核生成的多轮RL，收敛快1.93倍",
  "type": "论文",
  "topic_name": "AI Infra横向动态",
  "direction_name": "推理服务、运行时与编译优化",
  "published_at": "2026-08",
  "importance": "值得关注",
  "core_conclusion": "把GRPO式RL用于CUDA内核生成时奖励稀疏且多轮调试成本高；LEAP加难度条件剪枝与rank奖励，把编译与硬件探索集中到中等难度题，达相同精度快1.93倍。",
  "mechanism": "难度条件剪枝按采样组失败数门控，仅中等难度进入多轮分支；rank奖励把rollout按首轮通过到失败排序做配对锦标赛得相对优势，惩罚冗余轮次。",
  "result": "KernelBench上LEAP 3轮累计80.8%对baseline 75.2%、Dr.Kernel 80.4%；Level 3首轮30%对18%；达相同精度快1.93倍（8×B200）。",
  "boundary": "难度门控阈值仍为超参数且随训练漂移；评测限于KernelBench等未涉大规模生产内核；多轮最大轮数固定（M=2）。",
  "project_relevance": "判断：提供降低多轮RL编译与沙箱延迟的方法与去超参rank奖励，对低成本训练代码生成模型有参考，属训练侧方法。",
  "keywords": [
    "CUDA内核生成",
    "强化学习",
    "多轮调试",
    "GRPO",
    "奖励设计"
  ],
  "sources": [
    {
      "publisher": "arXiv",
      "url": "https://arxiv.org/abs/2608.01804v1",
      "source_level": "A",
      "primary": true,
      "published_at": "2026-08"
    }
  ],
  "discovered_via": null,
  "incremental_update": false,
  "incremental_change": null,
  "score": 78
}