{
  "title": "RestoreKV 用学习式 restore cache 弥补激进 KV 驱逐的信息损失",
  "type": "研究进展",
  "topic_name": "Agent语义加速",
  "direction_name": "Read、Grep、Glob和代码搜索加速",
  "published_at": "2026-08-04",
  "importance": "值得关注",
  "core_conclusion": "该方法在预填充后、驱逐前用少量可学习恢复令牌经单次适配前向生成紧凑恢复缓存，与保留的原始项在相同预算下组合，弥补查询无关驱逐丢失的信息。在 5% 预算下把某模型的准确率从 38.2 提升到 73.2。",
  "mechanism": "基础重要性评分与驱逐规则不变，适配层仅在恢复缓存生成时启用，训练采用冻结全缓存教师的自蒸馏并只更新约 0.4% 参数，无需任务特定调优。",
  "result": "60 个预算匹配设置中改进 59 个，16 倍压缩下达 86.4 准确率，32K 上下文恢复过程仅增 0.03–0.04 秒与 84MB 峰值显存，消融显示适配层贡献最大。",
  "boundary": "恢复需按模型与驱逐器离线训练约 2 小时，训练与推理驱逐器需匹配、跨驱逐器迁移有限，增益主要在激进预算下，原始论文编号未保留需回查。",
  "project_relevance": "判断：可作为既有驱逐流水线的即插即用增强以降低长上下文缓存的传输与存储成本，应验证其在我方驱逐器与模型上的迁移效果，并测量其在激进预算下的端到端收益。",
  "keywords": ["KV cache", "驱逐", "restore cache", "LoRA", "长上下文"],
  "sources": [
    {"publisher": "arXiv", "url": "https://arxiv.org", "source_level": "A", "primary": true, "published_at": "2026-08-04"}
  ],
  "discovered_via": null,
  "incremental_update": false,
  "incremental_change": null,
  "score": 76
}
