{
  "title": "NVIDIA Transformer Engine 训练加速教程：融合内核、BF16 与 FP8",
  "type": "教程",
  "topic_name": "AI Infra横向动态",
  "direction_name": "推理服务、运行时与编译优化",
  "published_at": "2026-08-01",
  "importance": "一般",
  "core_conclusion": "该来源为二手教程性概述，称 NVIDIA Transformer Engine 通过融合 GPU 内核、BF16 计算与硬件感知 FP8 执行加速 Transformer 训练，但原始页面抓取返回 403，正文不可得。",
  "mechanism": "据摘要，加速来自融合内核减少访存与 launch 开销、BF16 计算以及硬件感知 FP8 执行三项的组合，但具体融合算子、FP8 格式与缩放策略因正文缺失而无法确认。",
  "result": "仅有 335 字符摘要可得，无任何数值、对比基线或实验条件可定位，无法判断该教程是否包含真实 benchmark 或原创评测。",
  "boundary": "原始来源返回 403 Forbidden 不可确认，摘要为二手概述不能作一手证据，故 mechanism 仅据摘要推断而非可引用事实。",
  "project_relevance": "判断：当前无可定位事实，不应进入简报，需重抓或更换一手来源后再处理，暂仅作为待验证线索留存。",
  "keywords": [
    "Transformer Engine",
    "FP8 训练",
    "融合内核",
    "BF16"
  ],
  "sources": [
    {
      "publisher": "MarkTechPost",
      "url": "https://www.marktechpost.com/2026/08/01/accelerating-transformer-training-with-nvidia-transformer-engine-fused-kernels-bf16-fp8-and-gpu-benchmarking",
      "source_level": "B",
      "primary": true,
      "published_at": "2026-08-01"
    }
  ],
  "discovered_via": null,
  "score": 61.17
}